{
  "eventId" : "6ad4354c-8e79-4b49-b5d9-d45eb9689b41:13",
  "runId" : "6ad4354c-8e79-4b49-b5d9-d45eb9689b41",
  "seq" : 13,
  "type" : "RUN_COMPLETED",
  "occurredAt" : "2026-10-01T10:00:13Z",
  "data" : {
    "report" : {
      "answer" : "Kurumsal yönetim uyum raporuna göre ...",
      "citations" : [ {
        "chunkId" : "kap:1118495:0000",
        "sourceUrl" : "https://www.kap.org.tr/tr/Bildirim/1118495",
        "title" : "Özel Durum Açıklaması"
      } ]
    },
    "cost" : {
      "paymentsUsdc" : {
        "atomicUnits" : 30000,
        "asset" : "USDC",
        "decimals" : 6
      },
      "llmUsd" : {
        "atomicUnits" : 6923,
        "asset" : "USD",
        "decimals" : 6
      },
      "totalUsd" : {
        "atomicUnits" : 36923,
        "asset" : "USD",
        "decimals" : 6
      }
    }
  }
}
