{
  "eventId" : "6ad4354c-8e79-4b49-b5d9-d45eb9689b41:5",
  "runId" : "6ad4354c-8e79-4b49-b5d9-d45eb9689b41",
  "seq" : 5,
  "type" : "PAYMENT_APPROVAL_REQUIRED",
  "occurredAt" : "2026-10-01T10:00:05Z",
  "data" : {
    "approvalId" : "0b5c6a8e-3c1d-4b1e-9f0a-2f6d7c1e9a01",
    "paymentIntentId" : "75f93933-72b5-4604-ad2c-063e3f4e6ed6",
    "amount" : {
      "atomicUnits" : 20000,
      "asset" : "USDC",
      "decimals" : 6
    },
    "payTo" : "0x1111111111111111111111111111111111111111",
    "resource" : "http://seller-api:8081/v1/disclosures/THYAO/questions",
    "expiresAt" : "2026-10-01T10:05:00Z"
  }
}
